{
  "version": 1,
  "identity": {
    "canonicalName": "FaroNodeReservation",
    "hostname": "faro",
    "nodeId": "a8c4d414-175b-4369-8f9c-a8057ca53bdc",
    "address": "10.62.91.5",
    "network": "10.62.91.0/24",
    "formFactor": "virtual-machine-or-physical-vpn",
    "roleStatus": "fixed-edge",
    "capabilitiesStatus": "fixed-portal-telemetry-update"
  },
  "placement": {
    "hospedagem": "required runtime control-plane: NATS 10.62.92.7:14222 + cloudiff-control + PostgreSQL",
    "mauricio": "not required for heartbeat runtime; retained for HTTPS/SecureDistribution future updates",
    "forja": "not a baseline dependency; used only if future Faro capabilities require build/runtime"
  },
  "runtime": {
    "heartbeatPath": "Faro 10.62.91.5 -> NATS 10.62.92.7:14222 -> cloudiff-control -> PostgreSQL",
    "criticalPath": [
      "faro",
      "hospedagem"
    ],
    "forjaInCriticalPath": false,
    "mauricioInCriticalPath": false
  },
  "bootstrap": {
    "initialChannel": "SSH when access is explicitly provided by operator",
    "authorization": "explicit user decision 2026-08-21",
    "privateKeyGeneration": "on Faro only after SSH access",
    "csrSigning": "Agent PKI signer is root-only on hospedagem; CSR is generated on Faro and signed on hospedagem",
    "bundleContainsSecrets": false
  },
  "nats": {
    "server": "10.62.92.7",
    "port": 14222,
    "username": "a8c4d414-175b-4369-8f9c-a8057ca53bdc",
    "publishAllow": [
      "cloudiff.v2.node.observed"
    ],
    "subscribeDeny": [
      ">"
    ],
    "sourceAllowlist": [
      "10.62.91.2/32",
      "10.62.91.3/32",
      "10.62.91.5/32",
      "172.16.0.2/32",
      "172.16.0.3/32",
      "10.0.0.0/16"
    ],
    "passwordStorage": "runtime root-only; never committed",
    "clientCertificate": "pending CSR/key generation on Faro; CN/URI must bind nodeId",
    "externalIngress": "systemd socket proxy 10.62.92.7:14222 -> 127.0.0.1:14222; NATS Docker loopback-only; source allowlist on socket",
    "hostFirewall": "Hospedagem INPUT exact match 10.62.92.7:14222/TCP; allow only declared sourceAllowlist; drop all other remote sources; loopback control unaffected"
  },
  "controlPlane": {
    "host": "hospedagem",
    "service": "cloudiff-v2-control.service",
    "database": "cloudiff-v2-postgres",
    "requiredBeforeFaro": true,
    "tlsAccessFix": "/etc/cloudiff-v2 execute-only traversal for service user plus existing cloudiff-v2-nats group access"
  },
  "verification": {
    "ipAvailability": "verified-free-from-forja-and-mauricio-on-2026-08-21",
    "nodeOperational": false,
    "sshAvailable": false,
    "csrSigned": false,
    "heartbeatE2E": false
  }
}
